Sex,role,dataset,acton,About
Female,a,BCG,Hold,"The interaction involving a game with tokens and players A and B reminds me of the strategic decision-making often required in real-life scenarios, such as business negotiations or competitive situations. It's akin to the delicate balance between collaboration and competition that we encounter when trying to achieve personal goals while navigating interpersonal relationships and external factors. Just like in the game, real-life success often hinges on observing others, adapting to changing circumstances, and making decisions that serve both immediate and long-term objectives."
Male,b,BCG,Hold,Lending somebody money and not having assurance he will pay you back the money
Male,a,BCG,Hold,"Well, i see it kinda like stocks, in wich as longer as you hold to them, you get a bigger payout when evventually you decide to sell. Long term deals tend to be better in my point of view, due to interest"
Female,b,BCG,Hold,"This interaction reminds me, in a general way, of any human interaction. It's also comparable to exams; if you pass, both the student and the teacher benefit. On one hand, the student gains by passing the subject and continuing their learning, and on the other hand, the teacher benefits from having taught well, the satisfaction of their students learning, and the percentage of students passing, which contributes to their success as a teacher."
Female,b,BCG,Hold,If two people have to decide how things go they need to be on the same page 
Female,a,BCG,Hold,This interaction reminds me of making investments for the future hence I decided to pass in my decision.
Female,b,BCG,Pass,"It reminds me of gambling where you have to take a risk in hopes that you'll receive a higher return, and I think the study is trying to capture risk taking behaviour."
Male,b,BCG,Hold,am not sure but i think this blockchain or crypto or bitcoin because is the only thing that depend on being traded to increase value but if all of us we chose to hold then there is appreciation in value. 
Male,a,BCG,Hold,This is more about poker and gambling. There is also a factor of trust with the player. 
Female,a,BCG,Hold,You are gambling with tokens on whether the other person will hold or invest. You can't read someones mind so you have to trust your gut instinct and hope they have chosen similar to yourself.
Female,b,BCG,Pass,"It somewhat reminds me of working where the effort the boss gives is passed to the worker who also puts in effort. If the boss holds the profit, they benefit but if they pass and use it for the worker and business, it grows."
Male,b,BCG,Hold,Maybe getting to know some critical information. If you hold it by yourself you will get huge advantage 
Male,b,BCG,Hold,"Daily decisions can be based on this, one example could be when you get out with a friend to eat something, if you pay one day the other person might pay another day so It is a win win"
Female,b,BCG,Hold,This game was an example of how to anticipate reactions from others and how to respond. Life is calculated and our responses have major effect on everyone around us
Female,b,BCG,Hold,I think that the interaction is meant to mirror whether when given money the people would share or not. 
Male,b,BCG,Pass,"choosing a walking route, gambling thoghts. How decisions are made and risk assessement"
Male,a,BCG,Hold,"Maybe it is trying to capture a cooperation scenario, In my experience, people tend to approach collaboration either as a competition or as a good faith collaboration, but a lot are too selfish to try a true cooperation."
Male,a,BCG,Hold,it is trying to capture greed when it comes to giving? so as to you not expect being rewarded when being nice to others
Male,a,BCG,Pass,"Everyday life is a gamble, have you made the right choices? Have you turned the right way to avoid traffic? Did you treat someone like you should have done? I feel like it is trying to capture an understanding of how risk averse we are. Will most people choose to hold or will most choose to risk and give them away? It is kind of like society as a whole, generally someone with less will give more and someone wilth more is more likely to hoard their gains."
Female,a,BCG,Pass,It is about cooperation towards same goal. By working together and not trying to hold onto all the gains you may acquire more.
Female,b,BCG,Pass,It reminds me of give and take and that lots of things are not equal and lots of people are mostly concerned about themselves.
Female,a,BCG,Pass,"I cannot think of a specific example that is the same as the game but it is related to taking actions and see how egocentric people is, your action will be repercuting the gains of the other one so you will decide if it's better to share and both have a beneefit or just keep it all for your own, knowing that the other one will get nothing in return. "
Male,a,BCG,Hold,I think it reminds me of daily challenges where you need to choose either the safe or the risky option. For example you could save some of your money in cash someewhere in your home and theoretically (not including inflation) you would have the same amount of money in a year. But you could invest your money somewhere and hope for its' growth.
Female,a,BCG,Hold,"It reminds me of a game of probability or betting where you decide whether to hold or bet, but there's a chance that if you bet, you either win more or win nothing."
Female,a,BCG,Hold,"This interaction reminds me of the many chances I have to take in mu day to day life. Choosing to trust anothee to have the best interest of all parties in mind can be frightening but, in my opinion, taking these kind of risks can often be very rewarding. I think the researchers are trying to see how many people will choose a sure but worse outcome insted of trusting a stranger in the hope of a better one. "
Male,b,BCG,Pass,"It is trying to capture the way people interact and gain/lose according to other people's actions. Sometimes it is worth ""taking over"" (holding in this case) and minimizing risk. Other times you feel that it is ok to take the risk and rely on someone else, hoping the end result will be better for both of you."
Male,a,BCG,Pass,It reminds me of situations from everyday life and reading what intentions other people may have towards you
Male,a,BCG,Pass,maybe how gambling lotteries works or loans to the banks. the need to risk some to win more
Male,b,BCG,Pass,"I can't think of anything that completely captures the same feeling as this. However, I'd say the general concept of sharing is slightly similar to this in some way. If you don't share something, you still keep what you have despite the other person not getting to have it but if you share, you both have something even if it's not ""as much"" as the original piece."
Male,a,BCG,Hold,"In esence, this interaction reminds me on how we take decisions to have the best payoff posible when given an scenario in which you are competing with someone else. So we are willing to take the better option for us."
Female,a,BCG,Pass,"I'm sorry, I have no idea what this is trying to capture. For me it's just a game."
Female,a,BCG,Pass,"I think this activity is trying to show how people manage money. Do they prefer to share the profits from cooperation or take everything for themselves? When both parties decide to cooperate, we gain much more than when we try to take everything for ourselves."
Female,a,BCG,Pass,"I believe the task is about how you see the problems, either you go for it and take risks or you decide to be more careful and stay where you are. "
Male,b,BCG,Pass,"That's good not to be selfish, and it's great to be cooperative and do teamwork."
Female,b,BCG,Pass,"Very complex to fully understand first time,  must have patience and read slowly"
Female,b,BCG,Pass,"It's about looking out for both individuals, not always wanting everything for oneself. We should be sharing and considerate of others. You never know when that good deed you did might also come back to you."
Male,b,BCG,Hold,This interaction reminds me of any bargaining situation and the risk you may have to take. For example when you want to sell a product that does not have a specific price you may ask for a higher return than the products value. This way you may end up with a bigger profit but you risk the possibility of the buyer backing off.
Male,b,BCG,Hold,this strategy reminds me of digital currency tokens like crypto currencies. The aim is to be patient and not just go ahead and trade in a short space of time. The goal is to reap a greater reward than what was initially put in as i am doing now.
Female,b,BCG,Pass,"That doesn't really reminds me to something that had happened in my real life. However, I think it's trying to reinforce empathy. They do it by ""forcing"" you to play the game and telling you all the rules. If you're selfish, you can find you have less money, but if you are not both can have the same!"
Female,a,BCG,Pass,Reminds me of when i buy chocolate and hide it from my siblings and I don't want to share. Too much chocolate is bad for you but I'd rather have the slab by myself cause I bought it.
Male,b,BCG,Hold,It reminds of me the kinds of decisions that I have to make as I go about my daily life and think about the things that I have to get done and why I have to do them. My goal is to maximize my time and reduce my frustrations in my own life. 
Male,b,BCG,Pass,I think it is mostly about trust and trust issues. If we work together we can achieve higher goals. If we are just thinking about ourselves we have a solid but way less benefit. 
Female,a,BCG,Pass,"I believe in this task the the organisers are trying to capture the thought process in situations where people have to make a decision whilst taking a risk. here, whilst knowing that the decision of an unknown counterpart will affect my payment, I nave to decide what will possibly be the best."
Female,a,BCG,Pass,"I think is better to get something both of us since we are doing the same job, I think it reminds me on trying to help the others as well helping me "
Female,b,BCG,Hold,"For me, this does not remind me to anything that would truly be similar, however, I feel like this is how workplaces work, for example. I, as a basic worker contribute to my workplace with my time and effort, while they can keep all the reward from these, or share them with me. Also, if I do not contribute to my workplace, I will not be rewarded well enough (or, as menitoned, this might not be a good example, as in this case) I would not be rewarded at all"
Male,a,BCG,Pass,"whether I am more interested in choosing something that benefits more people than just myself, or whether I am more interested in my own benefit"
Male,b,BCG,Pass,I think it tries to capture how individuals depend on each other and can benefit more if they are willing to participate the same way. It reminds me when in school if we pair up we can achieve a lot more out of the assigned task. 
Male,b,BCG,Pass,"Well, this interaction I have just completed reminds me of simple favors that someone is doing for me and I choose to keep it in my mind and ""re-pay"" them with help once they need it. It is simple but I think it perfectly describes the interaction I just had"
Female,a,BCG,Pass,I think it tries to compare to maybe stocks in real life or something similar
Female,a,BCG,Pass,"This interaction reminds me of zero sum games, where we try to manage our expectations as well as other people's expectations. You can never predict what they behaviour might be, but you hope that they will compromise as to benefit not just the self, but the community. It's a situation that you find in a lot of environments, specially with managing people. What is best for one, might be put the other in a less favorable position, so what would people do with that knowledge? It really incaptures the human nature of social dynamics and power games."
Male,a,BCG,Pass,"Relationships in my job. Yeah I could win more being a selfish person, but that just simply doesn't go with me. Id feel too much guilty."
Female,b,BCG,Hold,it reminds me about taking changes in life if you dont take the chance to continue you never now what more you could gain 
Male,a,BCG,Pass,It's hard for me to relate this situation to everyday life. It reminds me of tests on children where they check whether they will choose one candy now or two in 5 minutes.
Male,b,BCG,Pass,"I always try to be a better person each day. If we do something for others every day, the world would be better"
Female,b,BCG,Pass,"Sometimes it is better to look at situations in a long term. Even if you must decide to, for example, share a decision with someone at work, if you do it alone you might just not lose but not win either for you'll have the glory but also loads of work to do alone. As it is always better to pass on, even it the goods get divided with someone else, but in the long term it compensates you with the amount of help you have to perform any kind of work ,and more rapidly."
Male,a,BCG,Hold,"Certainly, it seems like you're drawing a parallel between this decision-making scenario and the concept of giving or receiving change after making a purchase. While certain purchasing choices may initially affect the change you receive, it becomes clearer once the transaction is completed. In both situations, understanding the dynamics and roles involved can lead to more favorable outcomes."
Male,a,BCG,Pass,I am not completely sure but if i have to guess its about seeing if you are willing to play more safe or risk trusting someone for the chance at a higher reward. I guess since i do alot of stock trading it reminds me a bit of that but in a smallerr scale
Male,a,BCG,Pass,When I just came accors this type is question / situation. My first thought caught up of the business. If you invest some amount and if you keep adding your all efforts it will increase your over all profit and revenue in the end. So keep pushing and you will get there.
Male,b,BCG,Pass,"To be perfectly honest, I fail to make a connection between this situation and an instance in day to day life. My advice was simply regarding the way that I would react in such a situation. I would go for a low risk/low reward approach, seeing that with higher numbers I might lose my cool and let emotions cloud my judgement."
Male,a,BCG,Hold,"It reminds me of making a bet with my friends, and it's mostly about analyzing how a player's mind works when deciding how to play the bet. It's important to understand what the opposing player is thinking to increase your chances of winning. It's a game of psychology and strategy."
Male,b,BCG,Pass,"For me this is a win win situation, so, if you always stay humble and honest everyone can grow, you shouldnt hurt other people for your own financial interest because in this situation, someone trusted you to pass, if they did you should not trick them. For me, alwats stay humble, never look down or cheat on someone, because one day it can be you. The thoughts that the experiment is trying to get may be different from mine."
Female,b,BCG,Pass,"This reminds of working on a project with a team where each member is assigned a different role form others. At the end of the day, we all had to chip into one member's role because he was struggling with some tasks and we agreed that in order for all of us to finish, we needed to contribute and help him complete his tasks. This is the essence of team work."
Female,a,BCG,Hold,"I think it reminds me of lottery game or games of chance. Where you pay an entry fee for a chance to win a lot more than the entry fee, or sometimes just a little more than the entry fee. It's always a risk because you can lose the game and lose your entry fee."
Male,a,BCG,Hold,It really just reminds me wealth sharing. Should I share my wealth with the less fortunate or at least a part of it? But it also reminded me of strategic board games where I try to maximise my points. Regardless the lighthearted nature of these games I often clash with my game parthners.
Female,a,BCG,Pass,"we make decisions in our everyday life. so this gave it is like a probability of decision, whether it will happen or not or there is fifty percent chances"
Female,a,BCG,Pass, We are always having to make decisions. Think about the benefits but taking into account others. Be supportive of others so that they are supportive of us too.
Male,b,BCG,Hold,"This might be equivalent to any negotiation one might face during our lives, from bargain shopping on a street market to a negotiation with a potential customer in our jobs or even negotiating a paygrade on a new job. This might give an indication on the ammount of risk a specific group might be ready to accept, affecting most decisions in life."
Male,b,BCG,Hold,"Some times we have to think in beter actions, think in the other person to, and what he can provide to us, and never chose the easy way"
Male,a,BCG,Pass,I think that this interaction reminds me of a situation where if you work together with other person you can get more than if you are greedy and don't want to help achieve more with the other person or don't have enough trust on them.
Female,b,BCG,Pass,This felt a lot like community gain vs personal gain. Whether you as an individual are willing to work and be part of a community (team) or just place your needs above it all. It can feel risky because everyone is faced with the decision but if all decided to work as a team... it would benefit everyone more.
Female,a,BCG,Pass,"Maybe when I have to decide a win-win situation. When I have to work a lot and someone has not, we talk with each other and we talk about the situation. We take the 50-50 Method. They work 4hours and I work 4hours. They win because they get money, and I win because I do not have to work that much"
Male,b,BCG,Hold,Use your money (tokens) by investing it so your money can grow long term because it loses its value after a few years
Male,b,BCG,Pass,"It reminds me of the classic prisoner dilemma with a twist. In the game, I knew the other player decided to pass, helping me. It was a question of fairness versus selfishness."
Female,b,BCG,Pass,Decision making for personal gain. Or personal loss. It's to see how you think and capture your thought process for decision making
Female,a,BCG,Pass,I think all of this task is linked with investment. Maybe something like crypto distribution. I saw crypto projects that were working like that.
Female,b,BCG,Pass,"I think its trying to capture the mutual help between people, as well as hope in the other, as well as stimulate feelings of share and detect selfishness"
Female,a,BCG,Hold,"I would say that it remands me of a lot of things from daily life, for example the concept of delayed gratification. Like deciding to buy a lottery ticket you invest an amount but there is a chance of getting your investment back with some more. Or keeping the original money and having the same amount after. Or this could also represent keeping my money in the bank vs cashing it out which will lower its value and there any be any interest on it "
Male,a,BCG,Pass,"i coulnd think about anything, the best idea that comes to my mind is sending/recieving referals codes for some gambling sites"
Male,a,BCG,Pass,"I think it's about sharing with people. If u give something to people, they can give you something else im favor. In that way, both of you want some profits"
Male,a,BCG,Pass,"Reminds me of the ""17th tram"" situation: The tram comes every 5 minutes. Many times, I get to tram stop 5 or 4 minutes before the next one is coming. There is a store nearby, where it takes 3 minutes to buy a chocolate bar and a soda, but only if there is nobody else in the store. If someone else is there, I am most likely going to be latef from the tram. Everytime, I have to *take the risk* of having to wait for the second tram, when I decide to get a chocolate bar and a drink.  "
Female,b,BCG,Pass,This situation is like those real-life negotiations where making smart moves is essential to get the best results. It's all about strategy and making the right choices to reach the best possible outcome. 
Male,a,BCG,Pass,"This reminds of being helpful to other people. If we are eager to help, people tend to help us in return. Of course it is not always a case, but I believe we should give good example."
Male,a,BCG,Pass,"In my case, it reminds me of when one goes to a market where haggling is possible, where the seller tries to maximize their profit while selling the product, and the buyer tries to get the product at the lowest possible cost (maximizing cost-benefit). In this specific case of the survey, I believe it's about observing the behavior of two people who, knowing their roles, must choose what they think will be their best opportunity for benefit. If the situation warrants it, they may aim to maximize their gain or be fair to the other party and split the proceeds equally."
Female,b,BCG,Pass,"It reminds me that although vying for oneself might sometimes produce more ""money"" or a better individual outcome, we should also care about how our actions affect other people and a win-win situation for everyone is always the best outcome, in my opinion.  "
Male,a,BCG,Pass,This interaction reminds me of the interaction of investing and saving. Investing your money is similar to that of passing tokens as by adding more you accumulate more of your investment in the end of the process. And holding is similar to that of saving your money to accumulate interest.
Male,a,BCG,Hold,"it is interesting to think that player A is ""trusting"" but maybe is trying only to improve their odds, if player B decides to keep the money might be presented as a villain, but i dont think thats necessary the case. I bealive in the win win situations, but sometimes the fact that you trust someone doesnt mean you are doing it for the good reasons, it is because that also benefits you, so in this particular case i dont think there are a good guy or a bad guy, just decisions to make. Helping others is always better for me, but i wouldt judge my teamate "
Female,b,BCG,Pass,i think it is about considering other people as well as yourself and trying to do something that will benefit both people. It's about being generous but also looking out for yourself as well as others 
Female,a,BCG,Pass,"Personally, this action reminds me of those moments when you have to decide whether you're going to do something for your own benefit that might potentially affect someone else, or if you're going to choose to work as a team and share the gains."
Female,b,BCG,Hold,"This games doesn't remind me of any real life situation and again, I need more information about it to be able to have an opinion."
Female,a,BCG,Pass,This game reminded me quite of the businesses like cryptocurrencies and stock portfolios.
Male,a,BCG,Hold,"It reminds me of the game monopoly, the book by Robert Kiyosaki rich dad poor dad. It also remind me of people in general and how greedy and financial illiterate they are and how school does not want us to learn management of finances to gain financial freedom."
Male,a,BCG,Pass,"It reminded me of any time I have to make an impactful decision in my day to day life, whether it be choosing one company over another for services I need, or which product I buy in the store. Each decision I make has consequences to me and, most of the time , others. Making these decisions requires thought and a selfish viewpoint. It also sometimes requires us to trust in others for the best outcome. Perhaps this study is looking at how people make decisions when obvious risks and rewards are involved? Not sure!  "
Female,b,BCG,Pass,This interaction reminds me of the daily sacrifices l make of thinking of the other person before myself. I feel like this interaction is trying to show us and remind us of how god it is to be selfless and think of others .we should be able to share the little we have with others.
Male,a,BCG,Pass,I think it is similar to investing. There are similaritys with playing pokker or similar board games. It makes you think about when to cash out or stay in the game. When having a belief to eachother motives to move forward can benefit both parties. 
Female,a,BCG,Pass,"It's about how a person acts based on their beliefs, and how you can never know with certainty how the other person will act. Human behavior can be unpredictable, and decisions often depend on individual beliefs and perceptions."
Female,b,BCG,Pass,I think that this interaction is maybe trying to capture how likely we can share things with others. Also how likely we want not to think only about us. If two players decided to pass tokens they both get equally and fairly..  
Male,a,BCG,Pass,I think this interaction is trying to teach us that if we are willing to first give something away we are most likely to get something in return of higher value
Female,b,BCG,Hold,"I really have no idea, however it could be that it is good to interact with others at times. Then , there are other times that one just need to pause (hold)and take a breather. I think this is where you gain the most. Once done you can return to interacting with others."
Female,a,BCG,Pass,it reminds me of choosing what action would profit best for an individual or is it better to redistribute profits among both individuals
Female,b,BCG,Hold,It reminds me that it is very important to work well with others and to not be selfish. Always think about how the other person will be affected in what you do but also remember to focus on yourself too.
