Sex,role,dataset,acton,About
Female,a,BCG,Pass,"Because there is no strategy, its pure risk versus reward. Either way you are dependent on your assigned partner and it comes down to are you being selfish by opting to take 5 from the get go and being a party pooper, or do you leave it in their hands and hope they aren't going to be greedy. Such is life."
Female,b,BCG,Hold,I think the study is focusing on the aspects of greed in relation to people whom you don't personally know.
Female,b,BCG,Pass,"This is baffling to me. I think it was to reflect on giving to another person, instead of keeping the money for myself. It may be about selflessness "
Male,b,BCG,Hold,It reminds me of the fact that there are always scenarios where people who are trying to be helpful get screwed over. It happens every second of every day. Politicians and corporations are the biggest offenders.
Male,b,BCG,Hold,I'm really not sure what interaction this made me think of because I didn't think about anything other than the rules
Male,a,BCG,Hold,Trying  to see if you are willing to see how you will react to keepinv the tokens ir will you be kind enough  topass some of your tokens  
Female,a,BCG,Pass,I can't think of anything this interaction resembles in daily life. It might be trying to capture how much people are willing to trust strangers. Perhaps the interaction is meant to measure how much people go by logic vs emotion in these scenarios?
Female,a,BCG,Pass,"In life there are often situations where making short sighted, selfish decision may end in immediate payoff but not be very fruitful longterm. Often, society forces us into these situations even if we do not want to be selfish. For example, in a modern day wage labor system, we may have to look out for ourselves out of necessity since we often cannot physically afford to worry about or share with others."
Female,b,BCG,Pass,Determining the feelings of others. You deciding what is the best course of action to do the most good
Female,a,BCG,Pass,"It reminds me of gambling or any situation where you have to weigh your options. If you make a move too soon, you may end up in a worse situation. If you take too long, you could end up in a worse situation. It makes me think about timing of decisions the odds that it will turn out in your favor."
Male,a,BCG,Pass,Maybe as im a student it is really similar as for example when you write a test but you only knew certain parts of it so as to say your friend is getting the test that you know and you get the test that your friends knows. but on  the other hand is similar to like gambling 
Female,b,BCG,Pass,"It reminds me of bank investment. Honestly the options for player B are just ""doing their job"" or embezzlement, as long as we are comparing it to a real life scenario. Reminds me of games life the prisoner's dilemma and such."
Male,b,BCG,Hold,"This interaction reminds me of the prisoner's dilemma. It is trying to measure cooperation. However, the stakes are much lower in this game."
Female,b,BCG,Pass,"It kind of reminds me of a lunchroom. If one person passes on their helping of food, there could be more available for another person. This is kind of like roles an and b. "
Male,b,BCG,Pass,"Many decision involve choosing between what is best personally, and what is best for everyone. This can apply to something as simple as taking the last parking space, or something as complex as choosing environmentally sustainable products. Making a decision that is costlier personally, that has a net benefit to everyone can be difficult, bordering on impossible, but has larger implications to the psychology of decision making."
Male,a,BCG,Pass,"This exercise is trying to capture that if both sides agree and do the right things, both sides can be rewarded equally more than initially."
Male,b,BCG,Hold,"In a way, this scenario reminds me of giving money to others.  One person could give a little money to another; therefore, getting less money himself.  The person receiving the money has the option to keep more for himself or spread it out more equally."
Female,b,BCG,Pass,This interaction somewhat reminds me of the lottery or of gambling. I think it is trying to capture how or why people decide how to play. People who pass may be more trusting versus people who hold are less trusting. 
Female,a,BCG,Pass,I think this interaction reminds me to work with others and not be too cautious or too selfish. Being kind and loaning money can only help you in the end. I think this reminds me to be kind and to take a risk or I wonât get anywhere in life. 
Male,a,BCG,Hold,It reminds me of when countries need to get along but they don't want to be stabbed in the back. It's like when I have a project at work. We all know we need to work on it but no one wants to be stuck with the majority of it.
Female,a,BCG,Pass,"It reminds me of the importance in working together. When we work together, both parties can benefit. We can benefit doing things ourselves, but the reward is greater when we work together."
Male,a,BCG,Pass,trusting in others that they are playing to make each other better in life and not hoarding it just for themselves
Male,a,BCG,Pass,Its trying to describe the situattion of risk and gain. Pretty much as player a you are the average joe who can lose everything if the higher entity of wealth decide to screw you over. Meanwhile player B as the wealth entity can do what every he wants and still profit to a degree.
Female,b,BCG,Pass,It reminds me of people choosing to be selfish or choosing to care about other people as well. A lot of times people seem to choose the best for themselves and don't really care about the other person. They goodness there are other people that do care about other people besides themselves.
Male,b,BCG,Hold,"This interaction reminds me of human nature and how if everyone supports eachother, you are all likely to be more successful. This isn't perfect however, due to greed and the desire for more. Knowing this, I'd play the game safe and manipulate greed in to my own benefit just like in real life."
Female,a,BCG,Pass,"The majority of us do not live alone in the sense that we have daily interactions. Each day, we make numerous decisions to trust others hoping the outcome will be positive and the good deeds gets passed on. Sometimes we might be snubbed or sometimes what good goes around and comes back around. We just decide to give and knowing that whatever happens, we don't lose anything in our giving. "
Male,a,BCG,Hold,Im really not sure how to answer this question correctly but I would say that maybe its based on how your make decisions in life and what the outcomes can be if planned correctly for yourself or both parties involved.
Male,a,BCG,Pass,It kind of just reminds me of everyday life. We have to pay it forward and help each other and be trusting. If no then no one will make it. Thats why I was trusting and passed. 
Female,b,BCG,Pass,"Sometimes when you work together with others you are able to maximize and redistribute outcomes equally. Often we are in situations where we choose to keep or hoard more for ourselves, like during the pandemic when stores ran out of toilet paper because people were scared. However this situation allows for an outcome where you can both maximize the outcome and share it evenly so long as both parties choose to do so. I don't think that's very common."
Male,a,BCG,Hold,"Honestly, I am not sure. I can't think of anything right now in my daily life where I hold onto money and am guaranteed that money for holding it but then might get 0 or 3 times the amount back for ""loaning"" it. The stock market is all I can think about, but this is not exactly how it works at all. "
Female,b,BCG,Hold,"I think that this interaction attempts to assess the idea of generosity between strangers.  I also think it is meant to assess selfishness.  Since the players do not each others identity, aai think the game is a good indicator of different personalities and values."
Female,b,BCG,Pass,It can seem like daily life is a series of small decisions about taking risks. Do I run into the store without putting money in the meter? One is always measuring potential payoff versus a sure thing.
Female,a,BCG,Pass,I think the interactions are trying to capture trust between parties and decision making
Female,a,BCG,Pass,This interaction could be in reference to trickle down economy. Or about how if you both work together you will reap similar benefits vs. working for yourself. Working together is always the best and most equal option.
Female,a,BCG,Pass,"In daily life, it is about working together to make share the wealth I think.  But we will see how this plays out. Unfortunately in daily life, there are those who usually take all for themselves and don't worry about the needs of others."
Male,b,BCG,Hold,"I think this interaction reminds me the principle of greed. Sometimes it pays to hold and wait. Other times it pays to not hold and get your result. But usually if you hold, you will have your earnings and not have to split."
Male,a,BCG,Pass,I think it is capturing the idea of reciprocity and relying on others to achieve an outcome that maximizes the collective good. It asks the question of whether we can trust strangers to sacrifice some of their own well-being to generate even more well-being for someone else who helped them.  
Male,a,BCG,Pass,"I think it's trying to capture the decision of whether to depend on another for mutual benefit. I think on a bigger monetary scale, the game would be very hard. If it was $500, with a potential $2000 payoff for the second anonymous player, I don't see the Player A getting $1500 ever,  Maybe itâs trying to simulate what it like for an investor for a high risk crypto/business venture? I see stories of people scamming investors, taking all the investment money and not actually doing what the claim to? Maybe I'm overthinking it."
Male,a,BCG,Pass,Finding a mutually beneficial situation to cooperate. I can't think of an interaction in my daily life that operates like this. 
Male,b,BCG,Pass,"This interaction reminds me of situations in daily life where we must decide whether to trust someone and lend them money or any other resource. It also reflects the importance of reciprocity in relationships, since if both roles decide to lend, both benefit and end up with more resources. Overall, I think this interaction captures economic decision-making based on trust and reciprocity in our everyday relationships."
Female,a,BCG,Hold,"I think it's trying to capture how trusting people are or are not of strangers. I have found that strangers, especially when they are anonymous, simply look out for themselves. I feel a little guilty doing that, but I also feel like it might be the wiser financial decision, so that is what I do."
Male,a,BCG,Pass,"This interaction reminds me of working together to achieve a better result. If you hold in the scenario, you receive less tokens and if you keep things to yourself in real life, then other people may not benefit from what you have to share and you may not benefit from them as well."
Male,a,BCG,Hold,"This reminds me of reinvesting into something like stocks. If you hold, there is that, but if you buy another, there is a chance it will increase."
Male,a,BCG,Pass,"I think you're testing how much people feel trusting toward giving to the community. People can hold on to the resources they have and benefit themselves for sure, or they can give to a community pool and potentially benefit others and themselves more. There's a chance that someone will be greedy, but that chance is going to be there regardless."
Male,a,BCG,Pass,I could equate it to betting. In games found at casinos such as poker you often increase your initial starting amount if you play well but in the end you usually end up losing it all. I think this shows the balance between risk and pulling out while your ahead.
Female,a,BCG,Pass,It can capture trust between two companies that are trying to make the most money or keep their relationships
Female,b,BCG,Pass,"This doesn't really remind me of anything regarding my daily life. Maybe like a game of spades, where you're playing with a partner but really can't communicate? This is just a game of chance."
Female,a,BCG,Pass,"This reminds me of gambling or a coin toss with money involved. There probability and outcomes are limited and there is a fifty-fifty chance of passing or holding. It also reminds me of making a yes or no decision, because there are just two options."
Male,b,BCG,Hold,Iâm not too sure but maybe It is trying to mimick saving money. It also reminds me of any situation where you can make a small sacrifice in order to let everybody gain a little bit. It also reminds me of economic gaps in todays society
Female,a,BCG,Pass,"It reminds me of a time where I was working at my job and had to give a new employee advice. I felt a little unsure, but did my best. I think my knowledge was at least somewhat helpful. "
Male,a,BCG,Pass,"I think this interaction is trying to capture the essence of human greed or ability to work together to maximize outcomes. If people are greedy or mistrustful they will not pass and will not maximize their reward. If everyone works together the total rewards are higher for everyone involved. So its trying to capture that essence, as to whether or not people are out for themselves."
Male,a,BCG,Pass,It reminds me of a task that requires two teams to work together to complete a given task
Male,a,BCG,Pass,I am thinking maybe the research is trying to understand the role of selfishness and altruism when faced with earning potential. 
Female,a,BCG,Pass,"I think this interaction is a representation of the term ""give and you shall receive"". If you choose to pass you get 10 tokens. However, if you choose to pass then you both end up with more in the end. "
Male,a,BCG,Pass,I'm not certain what I'd correlate this exercise to in my daily life. Perhaps an exercise in greed versus sharing. A look at who wants the greater good for others versus who would prefer to keep an excess for themselves. What type of person would rather play it safe or roll the dice on an reliance of a stranger for a stronger outcome? 
Female,a,BCG,Hold,This particular decision doesn't really apply to my everyday life. I'm not in a scenario like this so it is not relatable. There might be something deeper that I'm not aware of. 
Female,b,BCG,Pass,I believe the decision goes into people's selfishness when making choices involving someone else. It is very easy to pick an option that could affect you positively and hurt someone else. This decision problem illustrates that very idea and the choices people make.
Female,a,BCG,Pass,I'm not sure if it reminds me of anything from daily life.  But it does require putting trust in others to do what is best for the group.
Male,b,BCG,Pass,"I could draw this from everyday life to, say, the morning public transport, when you have to travel with a lot of other people and have to decide whether or not to sit or give up your seat to someone else. Also, when you have to adapt to other people at work."
Male,a,BCG,Pass,I thought it was interesting to play. I think it's a lot like life in many aspects. One of the ways is being able to communicate in a stronger way that leads to a great and beneficial decision. I like how the game is played and enjoyed learning about it.
Female,b,BCG,Pass,"I think it is about how much trust people will place in strangers to be generous rather than keeping resources for themselves. If participant A chooses to pass then they risk getting no bonus. However, if both workers pass then the sum of the profit for the 2 individuals is higher. I think this survey wants to show if people will take that risk in the hopes of gaining more. "
Male,b,BCG,Pass,"This interaction reminds me of investing in stocks, and the risks and unpredictability of the economy"
Male,b,BCG,Hold,It reminds me of the myth of trickle-down economics. That the wealth passes along from the top to the bottom however this rarely occurs as people at the top have incentives to maximize profits and squeeze out the lower class of every penny they can
Male,b,BCG,Pass,It seems like it is trying capture the choices that people will make when money is involved. Given the capitalist hellscape we live in that means someone might try to take most or all for themselves when it is just as easy to split the outcome
Male,b,BCG,Pass,I think that it is trying to determin how selfish people are with money. The ideal situation would be for both to pass and end with an equal amount. If either decided to hold it ends up becoming a deficite to one or the other. It seem to be an example of the greater good concept.
Female,a,BCG,Pass,"Seeking advice from a more experienced friend on how to approach a particular activity, with an emphasis on strategy and calm."
Female,a,BCG,Pass,"The interaction immediately reminds me of the trust that I put in people every day. Similar to this scenario, if you pass and leave the decision in the hands of Player B, you have to have substantial trust in that person, or a lack of concern about losing out on everything, in order to pass it on. Similarly, in real life, for example, I have to have trust in people to lock my bike up and trust that it will not get stolen, and similar situations that are somewhat similar in terms of trust to this."
Male,b,BCG,Pass,"This reminds me of a group project I did where each person had a task to do so not one person would be overloaded with tasks. It was a fair allocation of time to each participant and it required trust the other coparticipant would do their part so the project would be finished on time with good results. Everything turned out fine in the project and I learned to be more trusting of people instead of doubting them and that I would be rewarded. This interaction is trying to show that if we work together and strive for an equitable result, everyone will be rewarded. "
Female,b,BCG,Pass,"this decision problem describes a basic interaction in the form of somewhat of a game. in the interaction, you decide without knowing your partners choice, whether to keep your points or whether to pass, in which you give 2 points to the other player. but you need to decide the same move to get your points so It pays to pass "
Male,a,BCG,Hold,"It reminds me of interactions where you put effort into helping someone else and hoping there's some form of return. Like perhaps I help my coworker and spends hours with some task. I would like to think that they can help me in the future when I need it as well. If they don't reciprocate, I simply spent a lot of effort and got my just desserts for believing they might help me. There's definitely a transactional type of trust component to the activity I just did, and real-life interactions."
Female,a,BCG,Hold,"Gambling is pretty risky, I would not put down an amount that I could not afford to lose. Always have some money put to the side in case of emergencies. Small risks are okay if you can afford to lose them."
Male,a,BCG,Pass,"I don't typically gamble so it doesn't capture much of my life, and when I do i usually regret it so It's not favorable to me.  I simply think this problem is trying to capture the average person's risk management process. It's attempting to recreate one of the more popular forms of gambling to do so (the ball drop game)."
Male,a,BCG,Hold,That the average person is always on the lookout for themselves and can't collectively work towards everyone's betterment. People are too focused on making sure that they get ahead. 
Male,a,BCG,Hold,"it reminds me of trust issues I have with people on aa daily basis. especially situtaions where I have to loan people money and decide whether or not I can live without it if they faail to pay me back. In most cases those who borrow, cannot really pay back the money and it is a personal decision whether or not to help them. This also reminds me of investment situtations where one is banking on earning interest on investments than may or may not pan out. "
Male,b,BCG,Hold,"If I am to be completely honest when answering this question, I really do not know what it is trying to capture. The interaction from daily life only comes in the form of that I have to make a decision, which is something you do on a daily anyways."
Female,b,BCG,Pass,"The interaction reminds me about how I choose to invest my time and energy into certain aspects of my life such as career, health, hobbies, and relationships with others. The decisions that I make usually come down to either invest or not invest into carrying out a decision/action. As a result I would see myself holding specific strengths and weaknesses on various aspects of my life and person. This is similar to how someone can choose to either pass or hold tokens. What I think the interaction tries to capture is how someone is willing to invest (or trust) a valuable commodity for a greater return. This not only applies to monetary investment, but also our time, energy, and confidence into an aspect such as a hobby, a career, their person, or a relationship with someone."
Female,a,BCG,Pass,"This interaction reminds me of playing chess. It also reminds me of grocery shopping on a limited budget, i.e., do I pay for the larger block of cheese that costs less per ounce, or do I choose to buy the smaller block of cheese which costs more per ounce, and allows more money to be left within my budget for the month. I'm honestly unsure what this study is trying to capture. Perhaps risk taking preferences among strangers. "
Male,b,BCG,Pass,It's trying to capture the ability to trust strangers and whether or not there is still faith left in humanity or if we're all just selfish morons who think for ourselves and keep profits to ourselves.
Male,a,BCG,Pass,"This interaction reminds me of stock market trading. You can either hold, keeping some money for yourself, or you can invest it. There is a chance that investing will yield nothing at all, but there is also a chance your money will be returned higher. You can also lose this money if ""B"" decides not to return (market crash or something)."
Male,a,BCG,Pass,"I think that this task reminds one that you can make your own decisions in life but much of the result depends on what others also decide. This is an important thing to remember. Just because you have a clear goal, there are other factors that will dictate whether or not it will be accomplished."
Female,b,BCG,Pass,there is nothing that this reminds me of in real life. it would be similiar to situations where you are trying to guage your risk aversion
Male,a,BCG,Pass,It was interesting so to speak. Nothing to hard. Pretty easy to understand.
Female,a,BCG,Hold,I guess it's trying to capture how much risk I am willing to take. If I loan the token then I am showing that I am willing to risk quite a bit since there is a possibility that I will earn 15 token. But there is also a very real possibility that I end up with nothing
Male,b,BCG,Pass,I think it is trying to capture what kind of advice I would give people. Is the advice to better oneself or do what is better for both parties. 
Female,a,BCG,Hold,i guess how people decide what they can and cannot do with money and how they handle it
Female,a,BCG,Pass,"This interactions reminds me of gambling in casinos. I don't gamble myself, but I always hear about ""high risk, high reward."" In this scenario, you are risking all your tokens only to lose them all or gain 3 times what you started with."
Male,b,BCG,Hold,It's a trust interaction. It is a gamble based on trust of a stranger. It is like driving in traffic.
Female,a,BCG,Pass,"Any situation that requires cooperation. In this scenario, if both parties choose what is best for both, they both end up winners. I thought of driving - if is top at a crosswalk to let a pedestrian cross, then we both get where we are going quickly. If either party ignores the other and focuses just on what is best for them. It could end very badly. "
Male,b,BCG,Pass,The interaction reminds me of making compromises with people. In daily life making simple decisions like asking to split the bill or pitching in on something with a group of people instead of asking one person to pay for the whole thing. I think it's trying to capture a situation where you can be selfish or be thinking for the group instead.
Female,a,BCG,Pass,I think that we make this choice every day in the way that we interact with others you have to decide all the time if connecting with strangers is worth the possibility that they will hurt you. And possibly the tendency to gamble.  
Male,b,BCG,Pass,This reminds me of work and consumer transactions. It has a process similar to buying and selling for profit. It feels like it could be used to determine work hours and activity output. It takes measure of risk assessment and reward balance.
Female,a,BCG,Pass,"It's kind of like choosing to spend your money at a local coffee shop. If you have $10 and choose to hold the money, i.e. keep it for yourself, the game ends. However, if you choose to spend your money on a coffee, then you get to enjoy a fun beverage and the coffee shop makes some money. If the coffee shop were to just take your money and hold it, not giving you a coffee, then it's like P1 passed and P2 held."
Male,a,BCG,Hold,"Aside from game theory, this problem reminds me of various political issues. Typically, Senators Representatives have very little impetus to ensure the greatest return for all Americans, but rather maximize returns for their constituency. This increases theirs odds for reelection. "
