Sex,role,dataset,acton,About
Female,a,BCG,Hold,"This interaction likely measures how trusting a person is of a stranger. As who are more trusting may gamble passing in hopes of both receiving 15. Conversely, an A who is less trusting may choose to hold to avoid ending up with 8"
Female,b,BCG,Hold,This interaction didn't make me think of anything in my daily life. It made me think I'm playing a bad game at an awful party where the rules make no sense to anyone. I wouldn't suggest this to anybody.
Female,a,BCG,Pass,This interaction reminds me of how we should really all work together in society if we want things to go better. It reminds me that of teamwork and cooperation! It also reminds me of the sad truth that other people in society will often look for opportunities to take advantage of others.
Female,a,BCG,Pass,"This reminds me a lot of just how difficult it can be to know the motivations of strangers, acquaintances, and coworkers in our winner takes all society. I'm definitely the kind of person who is much more comfortable with sharing unanticipated bonuses than with hoarding them for myself. However from personal experience even people who seem like non-sociopaths are sometimes very willing to behave selfishly and feel like they made a legitimate moral decision. Capitalism and libertarian ideals are hot garbage in my opinion."
Female,a,BCG,Pass,I think it is trying to test selfishness and maybe people's ability to trust an unknown person. 
Female,b,BCG,Hold,I think the interaction is asking how much faith you put in another person and how selfish one can think. This can be applied to lots of things in day to day life. 
Female,b,BCG,Pass,I think in a way it reminds me of doing good things for people. If someone does something good for me I am likely to do something nice in return. Hopefully it continues in a nice and fair pattern 
Male,b,BCG,Pass,"It reminds me of all the decisions that I make in daily life and the consequences that come from those decisions. I would usually think about what would happen if i do ""x"" or if I do ""y"" instead, and what consequences that follow. That is what I think this is trying to capture, at least, in my opinion."
Male,b,BCG,Hold,It might be looking into how selfish people are in life. It might be looking into how trusting people are. People's willingness to invest when they have to place their trust into someone else.
Female,a,BCG,Pass,"It seems like you are trying to see how someone would react if given a choice that will either benefit them or not and what they will choose when another person is also being affected. I have many interactions in my daily life that is is similar to, one of them is donating at the registers when shopping. "
Male,b,BCG,Pass,"This reminds me of compromise, any time you compromise someone you can run the chance of a win win situation."
Male,a,BCG,Pass,"If sharing resources like money, time, effort, food/goods ends up having the benefit of helping everyone versus those that hoard those items instead. "
Male,b,BCG,Hold,It reminds of of the risk that comes with managing money. This comes with loaning and investing money. Holding on less risky situations is the way to go. 
Male,b,BCG,Hold,I was assigned B and was told the A passed. Helping me obtain more than double what I already had.
Male,b,BCG,Pass,"It reminds me of social experiments that I've heard about before, which are usually set up with prisoner interrogations. Two prisoners are being interrogated, and if prisoner A gives evidence that prisoner B committed the crime then A will go free and B will receive the full sentence, and vice versa for prisoner B. If neither confesses then they will each receive half of the full sentence, but if both testify against each other then they both receive the full sentence. This interaction was similar, but it involved a positive gain, and the participants know the decisions of the counterpart. "
Male,a,BCG,Pass,"In general I find it is always best to think through a situation and find a solution that benefits everyone involved. I feel better about myself by trying to make things fair, and there are often intangible benefits to seeking out the most fair solution. It also helps to avoid any sort of resentment or ill will from others."
Male,a,BCG,Pass,"The decision reminded me of sharing food with friends. In such moments, we had to choose between generosity or selfishness. Fortunately, we always chose to be generous which strengthened our relationship."
Female,b,BCG,Hold,I think this is trying to judge 2 things. The first is if people think about others and what they might benefit over their own selfishness when making a decision. The second is if people are concerned about what they partner picked or what others might think of their choice
Male,b,BCG,Hold,It reminds me that all people act rationally and want to increase or maximize their individual (or family) outcomes.
Male,a,BCG,Hold," The decision issue appears to be similar to comparing different choices with varying outcomes, illustrating the intricacies of everyday decision-making involving careful consideration of multiple factors. This situation probably seeks to highlight the importance of thoughtful assessment in decision-making."
Female,b,BCG,Pass,I think it is trying to see if me as the B part am selfish to keep all the money or share with the person A.
Female,b,BCG,Hold," not  sure what it is trying to capture, reminds me of goldenballs on TV"
Male,b,BCG,Pass,"this reflects what the decisions the persons make on the daily basis, if they are selfish or if they think about the other persons around them"
Female,a,BCG,Hold,It reminded me of gambling - whether to actually make a bet or pass and not engage in gambling.
Male,b,BCG,Pass,"Ive seen this happen sometimes with some games where some people have the choice to either get 100 or split 50 with another person, depending on the choice of both. The problem is that now with no communication, which was present in my example, you just have to assume people are decent. "
Female,b,BCG,Hold,"This decision problem seems reminiscent of the classic moral dilemma of choosing between immediate gratification and long-term benefits. It encapsulates the struggle individuals often face when weighing short-term gains against potential long-term consequences. It reflects the complexity inherent in decision-making processes, where one must carefully consider various factors and potential outcomes before arriving at a choice."
Female,b,BCG,Pass,I think this interaction is trying to capture whether I should betray the trust of a person to obtain a larger gain at the cost of another person. 
Male,b,BCG,Pass,In the past i play a game similar like this. Someone told me that this type of activitie is trying to explain how the humanity can grow up .
Female,b,BCG,Hold,"Depending on what the other person chooses is not always good, and we don't always agree"
Female,b,BCG,Pass,"Honestly, it doesn't remind me of a real life interactions, but more on the things I see on social media, especially TikTok, were people are often put to similar test. They can either get a reward (they are often not informed of what it is) or pass it to another person. This situation is nonetheless created mostly for viewership and therefore I wouldn't call it a real life situation."
Male,b,BCG,Hold,"This reminds me of many group dynamics I have been in where I put the needs of the group above my own, when it was not necessarily ideal for myself. I think it is trying to measure the self centered-ness of human beings "
Male,a,BCG,Pass,"I think it's about cooperation. Or maybe about taking a risk. Some people are willing to take a risk if it means a future reward, some prefer to play it safe. Maybe it has to do with our personalities."
Male,b,BCG,Hold,I think maybe some type of gambling on forex. It reminds me all the decision making that I am doing during the day.
Female,b,BCG,Hold,"It appears to be linked to business practices: seller A sells something to me B, and if I continue the cycle and sell it forward, the final profit will be higher. Instead, if I choose to hold the material, and don't engage in further business, there's no profit. "
Female,b,BCG,Pass,"Trusting people - basically how we do things or rather move from a place of either safety or fear. When scared, you're more likely to choose to hold. Hold on to protect yourself, not do much for other people out of the fear of being taken for granted and/or taken advantage of. And we find it easy to pass in communities where we feel safe and know what I pass on, will 1. be replaced vy someone behind me who chooses to pass, and what I've given, will take care and be useful to someone ahead of me."
Female,b,BCG,Hold,"It reminded me of a game I used to play with friends when I was little, but I forgot the name. Also its about not being a jerk"
Female,b,BCG,Pass,"Perhaps this exercise is related to the theme of sharing/selfishness. We live in a world where selfishness prevails, so it's always interesting whether people keep everything (the tokens) or share in order to achieve more together. In my opinion, if we share we can both achieve something, so it's always preferable to share. "
Female,a,BCG,Pass,Sometimes its beneficial for everyone to do the right honest moral thing and not act only having in mind one self
Male,a,BCG,Pass,"It reminds me of teamwork. Everyone in the group receives remuneration depending on their involvement. However, it may not always be profitable."
Female,b,BCG,Pass,This scenario felt like a team-building or workplace situation. We both can win if we work towards the mutual end goal.
Female,a,BCG,Hold,"I previously did a similar survey where it was about deciding how much money I was going to save and how much I was going to put into a savings box for several participants, which if we all put more money, we would get more bonus and if we put less then we would only keep what we already had and even so we were given a certain part of the money that belonged to everyone. its like sharing fo rmutual gain"
Male,b,BCG,Hold,This interaction is trying to gauge how selfish people are when it comes to the distribution of funds. Without knowing what the other person it emphasises the need to trust what the other person might do. It is difficult to align this scenario to something that might be experienced in daily life.
Male,b,BCG,Hold,It shows how trusting in other people can make u earn more if you work together. It also tests if other person want to invest they money they receive or keep it for themself. Also first player takes the most risk so it requies bravery and trust into next person.
Male,b,BCG,Hold,"I think it represents the choices we have in our daily life, and the possible promblems that come with those decisions"
Female,b,BCG,Hold,"I think its trying to capture whether people decide to be selfish or selfless. Whether they will choose equality over higher values for themselves. It reminds me of sharing benefits equally between myself and my siblings, such as candies, or small amounts of money. "
Male,b,BCG,Pass,"This doesn't really remind me of any given choice I'd make in daily life, but it does seem to attempt to capture just about any resource conflict between two individuals, where the choice that most benefits both parties is ""locked"" behind the egoism of one of them."
Female,b,BCG,Pass,"whether we would risk to gain more by trusting others, or take  minimum vicory with surety. "
Male,a,BCG,Pass,"I think it reminds me of team work and how if two parties or more are willing to be kind then everyone will benefit more. If one does not contribute it's as if there is weak link in a chain, so to speak. This can cause the parties to suffer or yeild worse results."
Male,a,BCG,Pass,I think you want to highlight the part about the possibility of having a greater advantage for yourself versus the security of having a certain amount of money even if it is less. This would aim to better understand the psychology behind these types of choices and the percentage of people who would choose one thing over another.
Male,a,BCG,Hold,"it reminds me of the importance of saving investing money wisely, it is something crucial because even if we do not know when it should be used, there will always be an opportunity to invest it or save it strategically"
Male,a,BCG,Pass,"It's about trusting someone without knowing anything about them, it's like shopping online or using online banking, where you don't know the other person."
Male,b,BCG,Hold,I reminds me of sharing. It is trying to capture how we decide in lotto decisions. It is just a guessing and luck game.
Female,b,BCG,Hold,"This interaction reminds me of how every decision made on a daily basis has many contributing factors. Decisions are not typically just made without further thought about how it will affect you as well as others. In this scenario the play was for the most part dependant on what player B decided to do, as player A did not have much control over the situation after they had made their decision. Again showing that not only your own decisions, but also those of other people have a great potential to have either a positive or negative affect on you. "
Male,b,BCG,Pass,Maybe a banking situation or investment where if you just keep cash it stays the same but if you invest the money it will grow. 
Female,b,BCG,Hold,It might be trying to figure out if peoples thinking works in  the same way or if people are all like minded or trying to prove a difference in opinion
Female,b,BCG,Pass,that in daily life you also have to make decisions and make a decision or leave things as they are.
Male,b,BCG,Pass,"a case in which one person trusts the other and seeks empathy from this person, its a ""common"" theory game, wich the optimal for B is the ""selfish"" option,  then, we seek to recognize whether person b chooses to receive the greater benefit or ""rewards"" the first person for having ""treated well"""
Male,b,BCG,Pass,it is trying to captur how people deal with risk and if they choose to take the safest route and a garanteed payout or take the risk and trust the other contestant so that both get a bigger payout in the end
Female,a,BCG,Hold,"It reminded me of when my partner and I decide where to eat, we either hold (compromise) o pass (choose a different place than the ones we both mentioned)"
Female,a,BCG,Pass,"it reminds me of people in a conversation trying to say only as much as they can without disliked; if they both just talked and gave it all out instead of trying to match the other person, both people would benefit from the conversation"
Male,b,BCG,Pass,I believe it the test tries to see greed and how collaborative we are. If we can agree on working in a certain way that benefits both parties despite losing a bit in favour of others. Or if we'd rather have it all and not care about others.
Male,b,BCG,Pass,"I think what is trying to capture is the greediness that exist in people and how selfish can the people be. I also think that this game can characterize how a people can be described, if is a bold person or more a safe person. In other words, I think that this interaction remind me how pesky can people be."
Female,a,BCG,Hold,"I don't believe my opponent would give me points so I might as well keep them for myself! Establishing the dynamics of exchange between the parties and determining the roles. Risk is part of life along with uncertainty, which gives us the opportunity to learn daily"
Female,a,BCG,Pass,"It reminds me of certain situations at my job where we can choose to work alone or as a team. If we choose to work alone, we have to accept the risk of the project not being the best it could possibly be, while if we choose to work as a team, we can help eachother achieve a better outcome on the project. I think this interaction is trying to capture how humble or selfish we can be when working as a team knowing that if we all consent to working as a team, the outcome is the best possible."
Male,a,BCG,Pass,"I believe it is trying to figure out the way people think about investing their own money. In this case, we had to decide if we wanted to keep the tokens or not. It kind of reflects how people decide about investing their money, as it does not only depend on them (in this case, player B would be the bank/the entity in which the person invested the money). Our investments are dependent on us and other factors."
Male,b,BCG,Hold,"In life, we have to take risks to gain something but at the same time if we pass, we do not have the chance of losing, so it is becoming a thougth decision to make at the end but at the same it is an investement so we have to chosse the right choice that belongs in our hearts."
Female,b,BCG,Hold,"I think its trying to capture how decisions are made, particularly where personal gains are involved. It demonstrates trust in others to do what is best for the collective but in reality the best option for yourself is the selfish option. It reminds me of daily work life, where we work as teams but sometimes options should be considered for personal gain."
Female,b,BCG,Hold,This interaction reminds me of the probability and gambling for the greater good. it pushes teamworker and determines if one can make a good choice depending on the previous one
Male,b,BCG,Hold,It reminds me of a common interaction between people who are investing time in a mutual activity. It models how we interact on subjects and how our perception of the other halves thinking influences our decision.
Male,a,BCG,Hold,"It reminds me of a lot of other decision problems, which are thought how to solve best with game theory. The most known game to me is Prisoner's dillema. I think the problem is trying to capture what is a best decision to take where you don't have the knowledge what about your oponent will do."
Female,a,BCG,Pass,"The interaction is about the choices we make in life and the risks involved. It suggests that we often have to decide whether to give or receive, and that these decisions can be either assertive or not. Assertiveness is the ability to express your needs and wants in a clear and direct way, without being aggressive or passive. When we are assertive, we are more likely to get what we want and need. However, there is always a risk involved in making decisions, and we may not always get the outcome we want."
Male,a,BCG,Pass,"I think you try to make an experiment in which you would like to test the if the two parties are willing to lift on one other. By holding instead of passing you will receive eather 10 tokens or 22. By passing the amount you could receive is less, eather 8 or 15. By choosing hold tou can maximize the amiunt of tokens you potentialy receive. "
Male,a,BCG,Pass,"It's all about cooperation. If you pass the ball to each other correctly, you can maximize your joint profits over and over again. If it's only one round, you can decide either way, since the expected value is always 15. It's unpredictable"
Female,a,BCG,Hold,"i can't think of a real life example, but i just don't have enough trust to believe in somebody else's good faith, and i don't want to be the one to get less money. Karma is a bitch"
Female,b,BCG,Hold,"This interaction reminds me of investing in stocks. You have to know when to invest, hold or sell your assets to make profit."
Male,b,BCG,Hold,This game reminded me of a team cooperation game. Sometimes you have to make sacrifices to win more
Male,b,BCG,Pass,A cooperation problem for example in traffic when you choose to give someone else priority at an intersection when the situation is unclear. You may never see them again and it would save you time to take priority (hold). But ceding priority (passing) is beneficial to everyone when done reciprocally.
Male,a,BCG,Pass,"It reminds me of when I have to sharing something with my brother, it means that, where we both receive the same, or he receives the total and I get nothing, since for me it is preferable that my little brother receives everything than that he receives nothing"
Male,b,BCG,Hold,This interaction reminds me of trust in people. We can either be selfish and earn less or be together and make better progress in a shorter time
Female,b,BCG,Pass,I think this exercise is to try to understand if people are selfish and to what extent they trust another person for a common goal
Male,b,BCG,Hold,It reminds me of the game goldenballs split or steal. It is probably trying to capture the selfishness of human beings. From my daily life it reminds me of choosing whether to help others at my own expense.
Female,a,BCG,Pass,I find it easier to just go with my gut reaction when i have a difficult choice to make. Sometimes if you ruminate and overthink a decision you can make a choice that you regret. There is less to lose if you make a decision spontaneously.i think the problem is trying to find out what kind of person you are.
Female,a,BCG,Hold,"It reminds me gambling, where the amount you win on a bet influences your decision to bet again. It also reminds me of stock trading, which is a bit similar, and whether you invest again will depend on the return you make. I can't think of a situation where how much money you make is directly related to the decision of one person though."
Female,b,BCG,Hold,"It reminds me of how decisions I make just do not affect me but others when I'm at work. In being part of a team, my work contributes to the team's success but can also lead to personal success and bonuses. I can be awarded for my personal success but can also work hard and have another person be awarded a bonus in the team, basically showing how the excessive work culture for recognition is a gamble."
Male,b,BCG,Pass,"It reminds me the situation when we have to decide whether to hold our decision on a short term profit situation or proceed with a possible risk but gaining higher profit from that situation. It all depends on the the persons involved. If we think thoughtfully, In the future we both win from the right decision. It is trying to capture the bargaining interaction between two people."
Male,a,BCG,Pass,"This interaction resembles strategic decision making in various real life situations, such as negotiations or cooperative ventures. For example in trading, you risk some money, to get potential profit. There is a possibility that it won't go as you wanted to, but considering potential risk to win ratio, you decide what will be your choice"
Female,b,BCG,Pass,"This interaction reminds of that saying that if you do a good action, and the next person also does a good action, that you are sharing good and faith to other people, and I also think this is what it's trying to capture."
Female,a,BCG,Pass,"For me, it's about choosing to be self-serving or being a teammate. How your choices impact others. It's also reminding me of our risk appetite. "
Male,b,BCG,Hold,In my opinion this interaction is trying to check how I understand the system. Also it is checking how well I understand what I have read. It reminds me a time when I was in primary school and I had to read a text and then answer a questions about it.
Female,b,BCG,Pass,"I view it similar to ""nothing changes if nothing changes"". Meaning, if you want to do something and involve someone else, you both should put in joint effort cooperate so that the results at the end are worthwhile for both of you. Also, ""teamwork makes the dreamwork""."
Male,a,BCG,Hold,It reminds me of when you buy new food to try and you dont like it that much but do you like what your friend bought so you try to convince him to swap plates without him knowing it is because you actually didnt like it. 
Male,a,BCG,Pass,It is like a negotiation where two things decide wheter to hold their current resources or to pass some resources so it can benefits the both. It is like a business and personal relantionships. It shows a lot about the dynamic of decision/making
Male,b,BCG,Hold,"it reminds me of crypto exchanges, investing money and  trying not to lose ur money capital. Also it reminds me of risk management and everyday life situation when you have to decide between many things like either u wanna hold something that is very valuable for it to be more or sell it to gain money."
Female,b,BCG,Hold,"I am a student and when going to exercises, in order to get bonuses for being active, you must register. I have trouble speaking in front of large numbers of people. When i know the answer to a question, I often feel embarased to answer it  and while waiting, someone will be a jerk and already answer and get a point. Then, sometimes it happens only that there is another question to which I also know the exact answer. If I were more open and brave, I would answer the question and get a plus."
Female,b,BCG,Pass,How people work together and share equally or if they would rather be selfish and look to gain more at the expense of others
Female,a,BCG,Hold,"knowing that in our daily lives we go through many situations in which we have to decide whether to stay or not, in workplace for example, this interaction has a similarity for me with salary increases or job offers. Working together and cooperating."
Female,a,BCG,Pass,"It somehow reminds me of driving a car in traffic. I know it sounds unrelated, but the basic concept of trusting other parties in a mutually beneficial outcome is technically based on the same principle. Also it might refer to a general trust towards peers and people you encounter in your everydays."
Female,a,BCG,Pass,"I think this relates to the choices I make regarding studying or procrastinating. If I procrastinate, my knowledge remains the same, whereas if I choose to study, I gain more knowledge and I would be able to apply the intial knowledge at a higher level. "
